{
  "word": "square",
  "description": "Calculates the square of a number",
  "stack_effect": {
    "inputs": [
      {
        "name": "n",
        "type": "int"
      }
    ],
    "outputs": [
      {
        "name": "n²",
        "type": "int",
        "value": "n²"
      }
    ]
  },
  "properties": [
    "square(n) = n * n",
    "square(-n) = square(n)",
    "square(0) = 0",
    "square(1) = 1"
  ],
  "test_cases": [
    {
      "description": "Zero squared",
      "input": [0],
      "output": [0],
      "tags": ["base_case"]
    },
    {
      "description": "One squared",
      "input": [1],
      "output": [1],
      "tags": ["base_case"]
    },
    {
      "description": "Positive number",
      "input": [7],
      "output": [49],
      "tags": ["property"]
    },
    {
      "description": "Negative number",
      "input": [-5],
      "output": [25],
      "tags": ["property"]
    },
    {
      "description": "Large number",
      "input": [100],
      "output": [10000],
      "tags": ["edge_case"]
    }
  ],
  "complexity": {
    "time": "O(1)",
    "space": "O(1)"
  },
  "implementation": {
    "pattern": "DUP_TRANSFORM_001",
    "hints": [
      "Use dup * for simple implementation",
      "Consider CPU multiplication instruction"
    ]
  },
  "metadata": {
    "author": "FastForth Team",
    "version": "1.0.0",
    "created": "2025-01-14T00:00:00Z",
    "tags": ["math", "simple", "arithmetic"]
  }
}
