{
  "word": "factorial",
  "description": "Calculates the factorial of a non-negative integer",
  "stack_effect": {
    "inputs": [
      {
        "name": "n",
        "type": "int",
        "constraint": "n >= 0"
      }
    ],
    "outputs": [
      {
        "name": "n!",
        "type": "int",
        "value": "n!"
      }
    ]
  },
  "properties": [
    "factorial(0) = 1",
    "factorial(1) = 1",
    "factorial(n) = n * factorial(n-1) for n > 1"
  ],
  "test_cases": [
    {
      "description": "Base case: factorial of 0",
      "input": [0],
      "output": [1],
      "tags": ["base_case"]
    },
    {
      "description": "Base case: factorial of 1",
      "input": [1],
      "output": [1],
      "tags": ["base_case"]
    },
    {
      "description": "Small value: factorial of 5",
      "input": [5],
      "output": [120],
      "tags": ["property"]
    },
    {
      "description": "Medium value: factorial of 10",
      "input": [10],
      "output": [3628800],
      "tags": ["property"]
    },
    {
      "description": "Edge case: factorial of 2",
      "input": [2],
      "output": [2],
      "tags": ["edge_case"]
    }
  ],
  "complexity": {
    "time": "O(n)",
    "space": "O(n)"
  },
  "implementation": {
    "pattern": "RECURSIVE_004",
    "hints": [
      "Use recursive definition with base case check",
      "Optimize for tail recursion if possible"
    ]
  },
  "metadata": {
    "author": "FastForth Team",
    "version": "1.0.0",
    "created": "2025-01-14T00:00:00Z",
    "tags": ["math", "recursive", "classic"]
  }
}
